[
  {
    "spelling": "afraid",
    "pos": "adj.",
    "attributive": "no",
    "predicative": "yes",
    "gradability": "gradable",
    "comparison_strategy": "periphrastic",
    "complements": [
      {
        "type": "prep_of",
        "example": "afraid of dogs"
      },
      {
        "type": "to_infinitive",
        "example": "afraid to go"
      }
    ],
    "provenance": {
      "source": "curated_by_agent",
      "reviewed": true,
      "confidence": "high",
      "checked_at": "2026-07-30"
    }
  },
  {
    "spelling": "alive",
    "pos": "adj.",
    "attributive": "yes",
    "predicative": "yes",
    "gradability": "usually_ungradable",
    "comparison_strategy": "none",
    "provenance": {
      "source": "curated_by_agent",
      "reviewed": true,
      "confidence": "high",
      "checked_at": "2026-07-30"
    }
  },
  {
    "spelling": "alone",
    "pos": "adj.",
    "attributive": "no",
    "predicative": "yes",
    "gradability": "usually_ungradable",
    "comparison_strategy": "none",
    "provenance": {
      "source": "curated_by_agent",
      "reviewed": true,
      "confidence": "high",
      "checked_at": "2026-07-30"
    }
  },
  {
    "spelling": "angry",
    "pos": "adj.",
    "attributive": "yes",
    "predicative": "yes",
    "gradability": "gradable",
    "comparison_strategy": "inflectional",
    "complements": [
      {
        "type": "prep_with",
        "example": "angry with him"
      },
      {
        "type": "prep_about",
        "example": "angry about it"
      }
    ],
    "provenance": {
      "source": "curated_by_agent",
      "reviewed": true,
      "confidence": "high",
      "checked_at": "2026-07-30"
    }
  },
  {
    "spelling": "asleep",
    "pos": "adj.",
    "attributive": "no",
    "predicative": "yes",
    "gradability": "usually_ungradable",
    "comparison_strategy": "none",
    "provenance": {
      "source": "curated_by_agent",
      "reviewed": true,
      "confidence": "high",
      "checked_at": "2026-07-30"
    }
  },
  {
    "spelling": "awake",
    "pos": "adj.",
    "attributive": "no",
    "predicative": "yes",
    "gradability": "usually_ungradable",
    "comparison_strategy": "none",
    "provenance": {
      "source": "curated_by_agent",
      "reviewed": true,
      "confidence": "high",
      "checked_at": "2026-07-30"
    }
  },
  {
    "spelling": "bad",
    "pos": "adj.",
    "attributive": "yes",
    "predicative": "yes",
    "gradability": "gradable",
    "comparison_strategy": "inflectional",
    "comparative": [
      "worse"
    ],
    "superlative": [
      "worst"
    ],
    "complements": [
      {
        "type": "prep_at",
        "example": "bad at cooking"
      }
    ],
    "provenance": {
      "source": "curated_by_agent",
      "reviewed": true,
      "confidence": "high",
      "checked_at": "2026-07-30"
    }
  },
  {
    "spelling": "beautiful",
    "pos": "adj.",
    "attributive": "yes",
    "predicative": "yes",
    "gradability": "gradable",
    "comparison_strategy": "periphrastic",
    "provenance": {
      "source": "curated_by_agent",
      "reviewed": true,
      "confidence": "high",
      "checked_at": "2026-07-30"
    }
  },
  {
    "spelling": "big",
    "pos": "adj.",
    "attributive": "yes",
    "predicative": "yes",
    "gradability": "gradable",
    "comparison_strategy": "inflectional",
    "comparative": [
      "bigger"
    ],
    "superlative": [
      "biggest"
    ],
    "provenance": {
      "source": "curated_by_agent",
      "reviewed": true,
      "confidence": "high",
      "checked_at": "2026-07-30"
    }
  },
  {
    "spelling": "boring",
    "pos": "adj.",
    "attributive": "yes",
    "predicative": "yes",
    "gradability": "gradable",
    "comparison_strategy": "periphrastic",
    "provenance": {
      "source": "curated_by_agent",
      "reviewed": true,
      "confidence": "high",
      "checked_at": "2026-07-30"
    }
  },
  {
    "spelling": "bright",
    "pos": "adj.",
    "attributive": "yes",
    "predicative": "yes",
    "gradability": "gradable",
    "comparison_strategy": "inflectional",
    "provenance": {
      "source": "curated_by_agent",
      "reviewed": true,
      "confidence": "high",
      "checked_at": "2026-07-30"
    }
  },
  {
    "spelling": "busy",
    "pos": "adj.",
    "attributive": "yes",
    "predicative": "yes",
    "gradability": "gradable",
    "comparison_strategy": "inflectional",
    "provenance": {
      "source": "curated_by_agent",
      "reviewed": true,
      "confidence": "high",
      "checked_at": "2026-07-30"
    }
  },
  {
    "spelling": "careful",
    "pos": "adj.",
    "attributive": "yes",
    "predicative": "yes",
    "gradability": "gradable",
    "comparison_strategy": "periphrastic",
    "provenance": {
      "source": "curated_by_agent",
      "reviewed": true,
      "confidence": "high",
      "checked_at": "2026-07-30"
    }
  },
  {
    "spelling": "cheap",
    "pos": "adj.",
    "attributive": "yes",
    "predicative": "yes",
    "gradability": "gradable",
    "comparison_strategy": "inflectional",
    "provenance": {
      "source": "curated_by_agent",
      "reviewed": true,
      "confidence": "high",
      "checked_at": "2026-07-30"
    }
  },
  {
    "spelling": "clean",
    "pos": "adj.",
    "attributive": "yes",
    "predicative": "yes",
    "gradability": "gradable",
    "comparison_strategy": "inflectional",
    "provenance": {
      "source": "curated_by_agent",
      "reviewed": true,
      "confidence": "high",
      "checked_at": "2026-07-30"
    }
  },
  {
    "spelling": "clever",
    "pos": "adj.",
    "attributive": "yes",
    "predicative": "yes",
    "gradability": "gradable",
    "comparison_strategy": "both",
    "provenance": {
      "source": "curated_by_agent",
      "reviewed": true,
      "confidence": "high",
      "checked_at": "2026-07-30"
    }
  },
  {
    "spelling": "cold",
    "pos": "adj.",
    "attributive": "yes",
    "predicative": "yes",
    "gradability": "gradable",
    "comparison_strategy": "inflectional",
    "provenance": {
      "source": "curated_by_agent",
      "reviewed": true,
      "confidence": "high",
      "checked_at": "2026-07-30"
    }
  },
  {
    "spelling": "cool",
    "pos": "adj.",
    "attributive": "yes",
    "predicative": "yes",
    "gradability": "gradable",
    "comparison_strategy": "inflectional",
    "provenance": {
      "source": "curated_by_agent",
      "reviewed": true,
      "confidence": "high",
      "checked_at": "2026-07-30"
    }
  },
  {
    "spelling": "dangerous",
    "pos": "adj.",
    "attributive": "yes",
    "predicative": "yes",
    "gradability": "gradable",
    "comparison_strategy": "periphrastic",
    "provenance": {
      "source": "curated_by_agent",
      "reviewed": true,
      "confidence": "high",
      "checked_at": "2026-07-30"
    }
  },
  {
    "spelling": "dark",
    "pos": "adj.",
    "attributive": "yes",
    "predicative": "yes",
    "gradability": "gradable",
    "comparison_strategy": "inflectional",
    "provenance": {
      "source": "curated_by_agent",
      "reviewed": true,
      "confidence": "high",
      "checked_at": "2026-07-30"
    }
  },
  {
    "spelling": "dead",
    "pos": "adj.",
    "attributive": "yes",
    "predicative": "yes",
    "gradability": "usually_ungradable",
    "comparison_strategy": "none",
    "provenance": {
      "source": "curated_by_agent",
      "reviewed": true,
      "confidence": "high",
      "checked_at": "2026-07-30"
    }
  },
  {
    "spelling": "delicious",
    "pos": "adj.",
    "attributive": "yes",
    "predicative": "yes",
    "gradability": "gradable",
    "comparison_strategy": "periphrastic",
    "provenance": {
      "source": "curated_by_agent",
      "reviewed": true,
      "confidence": "high",
      "checked_at": "2026-07-30"
    }
  },
  {
    "spelling": "different",
    "pos": "adj.",
    "attributive": "yes",
    "predicative": "yes",
    "gradability": "contextual",
    "comparison_strategy": "periphrastic",
    "complements": [
      {
        "type": "prep_from",
        "example": "different from mine"
      }
    ],
    "provenance": {
      "source": "curated_by_agent",
      "reviewed": true,
      "confidence": "high",
      "checked_at": "2026-07-30"
    }
  },
  {
    "spelling": "difficult",
    "pos": "adj.",
    "attributive": "yes",
    "predicative": "yes",
    "gradability": "gradable",
    "comparison_strategy": "periphrastic",
    "provenance": {
      "source": "curated_by_agent",
      "reviewed": true,
      "confidence": "high",
      "checked_at": "2026-07-30"
    }
  },
  {
    "spelling": "dirty",
    "pos": "adj.",
    "attributive": "yes",
    "predicative": "yes",
    "gradability": "gradable",
    "comparison_strategy": "inflectional",
    "provenance": {
      "source": "curated_by_agent",
      "reviewed": true,
      "confidence": "high",
      "checked_at": "2026-07-30"
    }
  },
  {
    "spelling": "dry",
    "pos": "adj.",
    "attributive": "yes",
    "predicative": "yes",
    "gradability": "gradable",
    "comparison_strategy": "inflectional",
    "provenance": {
      "source": "curated_by_agent",
      "reviewed": true,
      "confidence": "high",
      "checked_at": "2026-07-30"
    }
  },
  {
    "spelling": "early",
    "pos": "adj.",
    "attributive": "yes",
    "predicative": "yes",
    "gradability": "gradable",
    "comparison_strategy": "inflectional",
    "provenance": {
      "source": "curated_by_agent",
      "reviewed": true,
      "confidence": "high",
      "checked_at": "2026-07-30"
    }
  },
  {
    "spelling": "easy",
    "pos": "adj.",
    "attributive": "yes",
    "predicative": "yes",
    "gradability": "gradable",
    "comparison_strategy": "inflectional",
    "provenance": {
      "source": "curated_by_agent",
      "reviewed": true,
      "confidence": "high",
      "checked_at": "2026-07-30"
    }
  },
  {
    "spelling": "empty",
    "pos": "adj.",
    "attributive": "yes",